Number,Full date,Day,Month,Year,Country name,Country code,Latitude,Longitude,Purpose of gathering,Fatalities,Injured,Crowd size,Description,References
76,"August 12, 1994",12,8,1994,Republic of the Congo,COG,-4.29569756,15.24922256,Religious,143,118,50000,"An accident occurred at a church when a sudden storm caused a crowd of up to 50,000 people to rush for shelter. The event resulted in the deaths of over 140 people, mostly children aged 4 to 15, and many were injured.",19940812.txt
77,"November 10, 1994",10,11,1994,Costa Rica,CRI,9.936754846,-84.10769101,Entertainment,1,25,-1,"During a show a fan was killed when the stadium gates were opened. The band was unaware of the incident and continued the performance. After learning of the death, they expressed their condolences through local networks to the victim's family and friends.",19941110.txt
78,"November 23, 1994",23,11,1994,India,IND,21.14940169,79.08039776,Political,114,500,50000,"Security police baton-charged a crowd of about 40,000 people after order broke down at a demonstration. The incident occurred as the crowd tried to escape. At least 113 people died, primarily women and children. Fences and barbed wire barricades had been installed prior to the incident. ",19941123.txt
79,"December 3, 1994",3,12,1994,USA,USA,40.66929046,-74.21586067,Entertainment,4,20,600,"In the early hours of the morning, an accident occurred at an overcrowded nightclub, as young people fled a brawl and became trapped in a narrow stairwell. Four people, including a 13-year-old girl, were killed, and over 20 were injured as the crowd surged and bodies piled up.",19941203.txt
80,"July 17, 1995",17,7,1995,Israel,ISR,31.25799841,35.20904343,Entertainment,2,150,20000,"Two people were killed and more than 150 people were injured in an accident at a rock concert. The incident occurred when the crowd of 20,000 people surged toward the concert doors. At least 20 people were seriously injured. Police and soldiers were called in to help control the crowd.",19950717.txt
81,"October 10, 1995",10,10,1995,Sierra Leone,SLE,8.471752671,-13.1869038,Religious,8,13,30000,"During a large religious gathering, an accident occurred, killing eight people and injuring 13 others. The meeting, attended by 30,000 worshipers, included claims of “miracle” cures. The cause of the stampede is unclear, with some reports suggesting that the appearance of a ""serpent"" caused the collective motion.",19951010.txt
82,"May 11, 1996",11,5,1996,Ireland,IRL,53.34846002,-6.226904204,Entertainment,1,-1,8500,"A deadly crush occurred at a concert at the front of the crowd, leading to the death of a 16-year-old girl and injuries to many others. Witnesses described being trapped in the crowd, with people losing their footing and others unable to get up as the mass surged and swayed. The band stopped playing and urged the crowd to calm down. ",19960511.txt
83,"June 16, 1996",16,6,1996,Zambia,ZMB,-15.37095984,28.26968358,Sport,15,78,40000,"An accident occurred as people tried to flee the stadium and a wall collapsed. Reports are conflicting on what caused the sudden crowd motion, but the stadium was reported being well over capacity. At least 9 people died.",19960616.txt
84,"July 9, 1996",9,7,1996,Libya,LBY,32.8599157,13.13571999,Sport,50,39,60000,"During a football match, riots erupted after spectators shouted anti-Gaddafi slogans. The situation escalated when bodyguards of Gaddafi's sons opened fire on the crowd, leading to a collective motion as thousands fled. Fans also stormed the pitch and attacked the referee, while rioters clashed with police and vandalized foreign cars.",19960709.txt
85,"July 14, 1996",14,7,1996,India,IND,23.18299786,75.76785408,Religious,39,35,200000,"Devotees trumbled in a narrow staircase inside a temple complex killing 39 people and injuring 35. Some were wounded by bamboo and steel wires as they were thrown against a temporary barricade. Gates' opening was delayed, appearently to let in VIP first.",19960714_1.txt
86,"July 14, 1996",14,7,1996,India,IND,29.95764881,78.17427266,Religious,21,40,2000000,"Devotees got killed as they were crossing an overcrowded bridge used on both directions to take a holy dip, resulting in 21 fatalities and 40 people injured. It is said that more than 2 million people had gathered for the event. ",19960714_2.txt
87,"July 31, 1996",31,7,1996,South Africa,ZAF,-26.00603657,28.2485598,Transportation,15,65,1000,Private security guards closed gates and attempted to control the crowd using electric cattle prods to prevent those without tickets to board a train after a campaign to crack down fare beaters was started.,19960731.txt
88,"October 16, 1996",16,10,1996,Guatemala,GTM,14.625764,-90.510489,Sport,84,147,45000,An accident occurred before the game started in an reportedly overfilled stadium (possibly due to counterfeit tickets) leading to the collapse of a fence separating different areas. 147 people were injured.,19961016.txt
89,"April 5, 1997",5,4,1997,Nigeria,NGA,6.497257113,3.364956447,Sport,5,12,40000,"Only two of the five gates were mistakanly opened at the end of a 40,000 packed soccer game. Crowds moved to the exits unaware that some of them were locked. It is believed stadium was over capacity.",19970405.txt
90,"June 28, 1997",28,6,1997,Germany,DEU,51.26024673,6.734150919,Entertainment,1,-1,60000,"In a concert attended by over 60,000 fans, a girl tragically died in the crowd. After discussions with security and police, the band chose to play softer songs to avoid further chaos.",19970628.txt
91,"August 5, 1997",5,8,1997,Peru,PER,-12.07862325,-77.08864827,Entertainment,2,107,100000,"At a concert over 100,000 fans gathered at a venue with a 40,000 capacity, resulting in a deadly accident. Two girls died from asphyxiation, and 107 others were injured. The overcrowding, poor event planning, and hysteria when the duo returned for an encore contributed to the disaster. Despite warnings from security, the performance continued.",19970805.txt
92,"April 9, 1998",9,4,1998,Saudi Arabia,SAU,21.413333,39.893333,Religious,118,-1,-1,Another incident among pilgrims attending the Stoning of the Devil ceremony killed 118 people and injured 180. Details are unclear.,19980409.txt
93,"April 18, 1998",18,4,1998,Zimbabwe,ZWE,-17.82132536,30.99494147,Entertainment,4,10,30000,A collective rush happened during celebrations for the independence day as thousands of spectators scrambled for seats for events which included a free soccer match between two popular teams.,19980418.txt
94,"August 22, 1998",22,8,1998,Philippines,PHL,14.59273363,120.9918904,Application,2,45,15000,"An accident at a presidential office. The crowd, estimated at 10,000 to 15,000 people, had gathered outside to seek help for issues like jobs and housing. Chaos ensued when a group of men broke the line, causing a surge toward the gates. In the melee, two women were trampled to death, and 45 others were injured, some seriously.",19980822.txt
95,"December 25, 1998",25,12,1998,Peru,PER,-12.04293571,-76.96037983,Entertainment,9,7,250,A tear gas bomb was exploded inside a nightclub facility and 9 people were killed as they tried to escape outside. The only door available was closed by security personnel believing a gang wanted to enter to steal or start a fight. Only 30 or 40 of the 250 people present managed to leave the nightclub.,19981225.txt
96,"January 14, 1999",14,1,1999,India,IND,9.435812812,77.08071966,Religious,53,-1,-1,"A landslide occurred at a temple during a religious pilgrimage, causing 200,000 male pilgrims to get scared and flee, which in turn caused a crowd incident. Some died in the landslide, but most were killed from the crowd itself. Most of the pilgrims were not familiar with the location as they came from far away.",19990114.txt
97,"May 30, 1999",30,5,1999,Belarus,BLR,53.905833,27.553889,Entertainment,53,100,2500,"A sudden thunderstorm during an outdoor concert caused many young attendees to attempt to take shelter in a nearby subway station. Some people slid and fell over on the wet sidewalk, causing a crowd incident. ",19990530.txt
98,"December 4, 1999",4,12,1999,Austria,AUT,47.248889,11.399167,Sport,6,38,40000,"As attendees left at the end of a snowboarding contest, many people slipped on the dark, steep slopes and fell into a barrier at the bottom of the hill. Dozens of people had been injured and were taken to the hospital, some in serious conditions.",19991204.txt
99,"March 24, 2000",24,3,2000,South Africa,ZAF,-29.91648609,30.88551396,Entertainment,13,44,600,"A tear gas canister was trow inside a nightclub in the afternoon when children were filling the facility. The emergency door was locked and the only way out was down a narrow staircase leading to the main entrance. Fatalities are said to have occurred on the staircase, where a wall also collapsed.",20000324_1.txt
100,"March 24, 2000",24,3,2000,Mozambique,MOZ,-24.53150435,32.9989498,Charity,5,10,-1,"An accident at a food distribution event resulted in the deaths of five people and left ten others injured. The incident occurred at a camp, which houses thousands of flood victims, when a large crowd rushed to receive aid. The chaos may have been triggered  a driver attempting to flee with a truck.",20000324_2.txt
101,"April 16, 2000",16,4,2000,Portugal,PRT,38.70416871,-9.176998074,Entertainment,7,65,1000,"Two canisters of gas were set off in a popular nightclub at the same time when lights went out, leading to a blind escape. The nightclub recently passed safety regulations inspections.",20000416.txt
102,"April 23, 2000",23,4,2000,Liberia,LBR,6.256935356,-10.7020419,Sport,3,-1,35000,A crowd surge occurred in an appearently overfilled stadium. One person died jumping from a fence to escape the dense crowd while others passed away for its consequences.,20000423.txt
103,"May 26, 2000",26,5,2000,Pakistan,PAK,31.59249012,74.30949064,Entertainment,8,3,-1,An accident occurred in a circus as guards used batons to break up an unruly crowd. It is believed people without ticket tried to force their entry in a break between shows when spectactors were leaving the circus. A special show was held that day close to where a religious congregation was also held.,20000526.txt
104,"June 5, 2000",5,6,2000,Ethiopia,ETH,9.03,38.74,Other/Unknown,14,7,-1,"An accident occurred in an amphitheatre during a memorial cerimony attended by thousands as children began running to cover from a rainstorm. More than 50 were injured, all victims were children.",20000605.txt
105,"June 30, 2000",30,6,2000,Denmark,DNK,55.621667,12.076667,Entertainment,9,26,50000,"Excited spectators surged towards the stage during a concert, resulting in 9 deaths and 26 injuries. ",20000630.txt
106,"July 9, 2000",9,7,2000,Zimbabwe,ZWE,-17.82141602,30.99503944,Sport,12,-1,60000,An accident occurred as police responded with tear gas to fans throwing plastic bottles in a near-capacity crowd causing many people to urge toward the exits. Fans leaving the stadium found more gas outside.,20000709.txt
107,"January 26, 2001",26,1,2001,Australia,AUS,-33.83755611,151.0667401,Entertainment,1,-1,-1,A teenage got killed in a mosh pit during a music festival. Barriers were not employed to split the crowd and were introduced in later editions following the incident.,20010126.txt
108,"March 2, 2001",2,3,2001,South Africa,ZAF,-26.19743045,28.0422214,Transportation,7,9,-1,"An accident occurred as commuters rushed down stairs toward a main-line passenger train. Dynamics is not clear although it is believed security locked the gates and an annoucement on the sudden closure was made only 10 minutes before departure, leading passengers to rush.",20010302.txt
109,"March 5, 2001",5,3,2001,Saudi Arabia,SAU,21.413333,39.893333,Religious,35,-1,30000,An incident occurred among pilgrims attending the Stoning of the Devil ceremony.,20010305.txt
110,"March 18, 2001",18,3,2001,Indonesia,IDN,-6.2,106.816667,Entertainment,4,4,2000,"Teenage girls got killed at the front of the stage during a performance of a boy band in a shopping mall. The band performed without a stage. The accident occurred as the band started signing autographs. A similar appearance was canceled after 20,000 stormed the venue.",20010318.txt
111,"April 1, 2001",1,4,2001,Pakistan,PAK,30.341111,73.3875,Religious,44,100,100000,"Thousands of men crammed into a narrow street leading to the main door of a shrine. A collective rush occurred as the opening of the shrine was delayed by more than 3 hours with about 100,000 people waiting. Becoming restless amid the delay some of them opted to seek entry through a secondary gate out-of-bound leading to a scramble in which 44 got killed and about hundred were injured.",20010401.txt
112,"April 8, 2001",8,4,2001,China,CHN,34.52731751,110.0823102,Shopping,16,6,4000,"An accident at a temple fair killed 16 people and injured 6 others. The tragedy occurred when a large crowd became trapped in a narrow passageway leading to the temple. Despite efforts by police and local officials to manage the crowd and assist the injured, the incident resulted in fatalities.",20010408.txt
113,"April 11, 2001",11,4,2001,South Africa,ZAF,-26.197519,28.060767,Sport,43,-1,120000,"A crowd of fans who were trying to find tickets for a soccer match surged into an already over-capacity stadium when the match began to heat up, destroying the perimeter fence in the process. The sudden flow of people caused a crowd incident near the entrance gate.  ",20010411.txt
114,"April 29, 2001",29,4,2001,DRC,COD,-11.70460124,27.48402601,Sport,14,-1,-1,Police fired tear gas to unruly fans who had invaded the pitch leading to an ensuing crowd accident. Fans were believed to had thrown objects at each other. The main exit was blocked leading to no way out.,20010429.txt
115,"May 6, 2001",6,5,2001,Iran,IRN,36.56012686,53.04824745,Sport,15,500,25000,A roof collapsed as spectactors reportedly sat on top of a temporary scaffolding in a crammed stadium said to have been well above capacity. Hundreds have been injured.,20010506.txt
116,"May 9, 2001",9,5,2001,Ghana,GHA,5.551531,-0.191767,Sport,126,-1,45000,Extreme behavior from some of the fans at a soccer match led to the police responding with tear gas. Many spectators tried to evacuate simultaneously. A crowd incident occurred because there were too few exits and the exits that did exist had been locked. ,20010509.txt
117,"July 21, 2001",21,7,2001,Japan,JPN,34.64390035,135.0174283,Entertainment,11,247,150000,"An incident occurred just before the end of a firework display, as a crowd of spectators trying to leave ran into a crowd of people going in the opposite direction on a pedestrian bridge between the railway station and the venue. 247 sustained injuries. The exit stairs of the pedestrian bridge acted as a bottleneck, as they were half the width of the bridge itself.",20010721.txt
118,"August 8, 2001",8,8,2001,Bangladesh,BGD,23.81641586,90.36586958,Other/Unknown,23,40,2000,A worker in a garment factory sounded the alarm after seeing flames shooting from an electric circuit board. Workers converged to the stairs to find the single exit locked and the security guard absent. ,20010808.txt
119,"October 21, 2001",21,10,2001,Venezuela,VEN,10.14194829,-67.99597368,Entertainment,11,60,30000,"An accident occurred at a festival when thousands of people tried to force their way into the venue, which was already over capacity. Police fired warning shots, triggering a surge that led to people being trampled. Witnesses offered conflicting accounts, some claiming a riot broke out, and others said the crowd was calm before the police intervention.",20011021.txt
120,"December 15, 2001",15,12,2001,Brazil,BRA,-10.90438683,-37.08158747,Charity,4,60,60000,"A crowd of about 60,000 people attended a gift distribution event. A wall collapsed and the resulting confusion killed 4 and left several injured. 10 militars were reportedly on-site to manage the large crowd, although 70 were planned to be on service.",20011215.txt
121,"December 21, 2001",21,12,2001,Bulgaria,BGR,42.7,23.33,Entertainment,7,-1,1500,A crowd incident occurred as attendees tried to enter the venue for a Christmas party because the stairs that led into the venue had become frozen and were slippery. Six people between the ages of 11 and 15 died. ,20011221.txt
122,"January 24, 2002",24,1,2002,Nigeria,NGA,7.147595564,3.361916612,Religious,3,-1,-1,"During an evangelist crusade, three elderly men in their late 60s were feared dead in a crowd accident. The victims were reportedly trampled by the large crowd attending the miracle event on the second day of the crusade.",20020124.txt
123,"January 27, 2002",27,1,2002,Nigeria,NGA,6.573505329,3.36215172,Other/Unknown,1000,5000,4000,"A series of explosions at a military depot triggered widespread panic, leading to the indirect deaths of hundreds people in crowd accidents. The massive blast killed around 300 people and sent debris across the city, igniting fires and causing chaos. Thousands of people fled toward a banana plantation, resulting in at least 600 drownings.",20020127.txt
124,"March 9, 2002",9,3,2002,Nigeria,NGA,6.436235493,7.488267452,Religious,14,-1,-1,"Gunmen attacked a weekly prayer meeting causing a collective flee that killed at least 12 people. The gunmen appeared to be targeting a priest, who was leading the meeting, but left without injuring anyone. The incident occurred as the open-air service was ending, and conflicting reports suggest the death toll may be higher.",20020309.txt
125,"September 23, 2002",23,9,2002,China,CHN,40.437,113.11,Educational,21,47,1500,"Students in a middle school attempted to leave evening classes in complete darkness. Not being able to see, students could not understand the situation and kept pushing. Eventually a guardrail collapsed killing 21 and injuring 47. It is said two teacher were on duty to manage 1563 students and the school was designed for 800.",20020923.txt
126,"September 28, 2002",28,9,2002,India,IND,26.83268734,80.92671986,Transportation,18,25,-1,"During a commotion people tried to protect others from becoming involved. As a result of this event the crowd was pushed down the stairs toward the two platforms, increasing crowd density at the end. In the chaos some climbed on an arriving train and got electified by the overhead high tension wire. A lot of people were arriving for a political rally.",20020928.txt
127,"November 30, 2002",30,11,2002,Bangladesh,BGD,25.32958728,89.54261812,Charity,47,200,10000,"A crowd accident killed at least 30 women and children and injured hundreds as people for free clothes being distributed by a local businessman. The stampede occurred outside an abandoned jute mill as the crowd surged forward when the gates were opened. The distribution attracted over 10,000 people, mostly poor women and children.",20021130.txt
128,"January 5, 2003",5,1,2003,China,CHN,34.35358789,107.4065082,Educational,3,19,3500,"A power loss occurred in a middle school in the afternoon. As power could not be restored it was decided to cancel evening classes and let the students go home. Students in the classroom upstairs rushed down the stairways as students in the playground rushed upstairs to get their bags, eventually clashing on the stairs. 19 were injured.",20030105.txt
129,"February 11, 2003",11,2,2003,Saudi Arabia,SAU,21.413333,39.893333,Religious,14,-1,-1,An incident occurred among pilgrims attending the Stoning of the Devil ceremony.,20030211.txt
130,"February 17, 2003",17,2,2003,USA,USA,41.849542,-87.623514,Entertainment,21,50,1500,"Security guards trying to break up a fight at a club used pepper spray, causing chaos among the 1,500 attendees as many believed that they were being attacked by terrorists and tried to flee towards the exit. The exit was at the bottom of a steep flight of stairs and the door to the street was narrow, and opened inwards. 21 people died from suffocation. ",20030217.txt
131,"May 3, 2003",3,5,2003,Benin,BEN,6.385962935,2.379426849,Entertainment,15,12,-1,An accident occurred as stadium gates were opened for a concert by a popular artist. Gates opening was delayed by a previous event held in the same venue.,20030503.txt
132,"August 27, 2003",27,8,2003,India,IND,20.007921,73.79129556,Religious,39,150,300000,"The throwing of silver coins to a crowds of pilgrim leading to a religious event was believed to have caused a collective rush which killed 39 and injured about 150. A different source said the collective motion was caused as pilgrims rushed for the holy dip after sadhus (holy men), already late in their bathing, had finished.",20030827.txt
133,"December 11, 2003",11,12,2003,China,CHN,36.45390159,114.5537765,Educational,5,15,-1,"An accident occurred on stairs after students were leaving a middle school in the darkness due to a power loss. 15 children were injured, 4 of them seriously.",20031211.txt
134,"February 1, 2004",1,2,2004,Saudi Arabia,SAU,21.413333,39.893333,Religious,251,244,-1,An incident occurred among pilgrims attending the Stoning of the Devil ceremony. Over 200 people were injured.,20040201.txt
135,"February 5, 2004",5,2,2004,China,CHN,40.37220336,116.8372427,Entertainment,37,15,5000,"A large number of people moving against the flow of the crowd caused an incident on a bridge between two venues that were separated by a river at a New Year lantern festival. 37 people died, many of them women and children. There were reports that the bridge was crowded with people watching fireworks at the time of the incident. ",20040205.txt
136,"February 23,2004",23,2,2004,Indonesia,IDN,-3.317095326,114.5801001,Entertainment,4,60,4000,"An accident at a rock concert killed four people and injured dozens more. The incident occurred as thousands of fans, mostly young, rushed to exit the soccer stadium after the performance.",20040223.txt
137,"March 12, 2004",12,3,2004,Syria,SYR,37.047778,41.220556,Sport,5,100,-1,An accident occurred as spectators escaped from rioting fans. More than 100 people were injured.,20040312.txt
138,"April 12, 2004",12,4,2004,India,IND,26.88087622,80.94235492,Political,21,-1,10000,"About 10,000 women with babies and small children attended a rally held in a park. The accident occurred as the end of the event was broadcasted and it was announted people could collect gifts at the reception counter. This led to a large number of women hurrying toward the reception counter near the exit. 21 women and children died.   ",20040412.txt
139,"May 3, 2004",3,5,2004,Bangladesh,BGD,23.81783601,90.36560979,Other/Unknown,6,30,4000,The explosion of an electric transformer nearby initiated an evacuation in a six-story garment factory. Workers rushed on the stairwells killing 6 and injuring at least 30.,20040503.txt
140,"August 29, 2004",29,8,2004,Brazil,BRA,-23.46176374,-46.49058107,Entertainment,6,117,-1,"An overcrowded balcony collapsed in a nightclub, killing six people and injuring at least 117. The collapse occurred when the balcony, holding more people than its structure could support, gave way, crushing those below.",20040829.txt
141,"September 1, 2004",1,9,2004,Saudi Arabia,SAU,21.55949604,39.15277432,Shopping,3,16,8000,"A furniture store held an event at which the first 50 people to attend would each receive a gift certificate worth 500 Rial, and the next 200 attendees would each receive 100 Rial vouchers. More than 8,000 people gathered outside the store before it opened. Despite being scheduled to open at 10am, the store opened at 9am, and the crowd broke through the safety barriers.",20040901.txt
142,"October 10, 2004",10,10,2004,Guinea,GIN,9.545770802,-13.67300421,Sport,3,-1,35000,"Three people were killed in a crush outside a soccer stadium ahead of a World Cup qualifying match. The incident occurred as fans rushed to buy tickets and surged while waiting to enter the 35,000-seat stadium through its four entrances. The victims were trampled, and all injured individuals were taken to the hospital.",20041010_1.txt
143,"October 10, 2004",10,10,2004,Togo,TGO,6.202153075,1.239729531,Sport,4,8,-1,"At the end of a soccer game lights went off due to a power outage causing fan to run for the exits. Another 8 people were injured, 3 critically. The stadium was recently built.",20041010_2.txt
144,"November 13, 2004",13,11,2004,India,IND,28.64282557,77.2191645,Transportation,5,10,-1,Passengers rushing to catch a leaving train struggled on stairs during one of the biggest holiday of the year. It is believed two women slipped on the stairs triggering the accident.,20041113.txt
145,"November 20, 2004",20,11,2004,Togo,TGO,6.120990168,1.211730786,Political,13,216,200000,"People got killed at the gates as they tried to surge into the president's palace when the gates were thrown open. That day a political march was organized, with the number of participants (hundreds of thousand) underestimated. Some reports suggest people were hoping for banknotes handout from the president. ",20041120.txt
146,"January 25, 2005",25,1,2005,India,IND,18.0465596,73.87597011,Religious,291,-1,300000,"A pilgrim at a religious festival attracting more than 300,000 people fell on the steep and narrow stairs to the temple, which had become slippery with palm juice used in the offerings, and caused a crowd incident. Subsequently, an electric wire short-circuited at a nearby store, causing a fire that spread to cooking gas cylinders, which then exploded. ",20050125.txt
147,"February 26, 2005",26,2,2005,Burkina Faso,BFA,12.369028,-1.5535,Entertainment,2,15,4000,An accident occurred on the more shaded area as stadium gates for a film festival were opened in a scorching day. That day also featured a concert by a well known singer. Between 10 and 20 people were injured.,20050226.txt
